[
  {
    "id": "consultants_task_04_consultation_structure_information_gathering",
    "programId": "program_certificate_consultation_patient_coordination",
    "moduleId": "consultants_module_04_consultation_structure_information_gathering",
    "slug": "structured-consultation-note-task",
    "title": "Structured Consultation Note Task",
    "taskType": "documentation",
    "status": "draft",
    "instructions": "Produce a neutral consultation support note using the academy structure.",
    "submissionFormat": ["text"],
    "facultyReviewRequired": true,
    "rubric": [{ "id": "r1", "label": "Structure and neutrality", "weight": 10, "guidance": "Assess structure, clarity, and scope-safe wording." }],
    "linkedCompetencyIds": ["consultants_competency_04_structured_information_gathering"],
    "linkedComplianceNoticeIds": ["notice_consultants_competency_scope"]
  },
  {
    "id": "consultants_task_05_candidate_screening_suitability_support",
    "programId": "program_certificate_consultation_patient_coordination",
    "moduleId": "consultants_module_05_candidate_screening_suitability_support",
    "slug": "screening-escalation-task",
    "title": "Screening Escalation Task",
    "taskType": "case-triage",
    "status": "draft",
    "instructions": "Document a screening scenario and identify the escalation trigger and next action.",
    "submissionFormat": ["text"],
    "facultyReviewRequired": false,
    "rubric": [{ "id": "r2", "label": "Triage and escalation logic", "weight": 10, "guidance": "Assess safety, documentation quality, and escalation timing." }],
    "linkedCompetencyIds": ["consultants_competency_05_candidate_screening_support"],
    "linkedComplianceNoticeIds": ["notice_consultants_escalation_duty"]
  },
  {
    "id": "consultants_task_07_communication_excellence_trust_based_consultation",
    "programId": "program_certificate_consultation_patient_coordination",
    "moduleId": "consultants_module_07_communication_excellence_trust_based_consultation",
    "slug": "trust-based-communication-roleplay",
    "title": "Trust-Based Communication Roleplay",
    "taskType": "communication",
    "status": "draft",
    "instructions": "Draft or roleplay a trust-based response to a hesitant patient while preserving role boundaries.",
    "submissionFormat": ["text"],
    "facultyReviewRequired": true,
    "rubric": [{ "id": "r3", "label": "Communication quality", "weight": 10, "guidance": "Assess empathy, realism, and scope-safe wording." }],
    "linkedCompetencyIds": ["consultants_competency_07_patient_communication"],
    "linkedComplianceNoticeIds": ["notice_consultants_competency_scope"]
  },
  {
    "id": "consultants_task_10_clinical_photography_documentation_handover",
    "programId": "program_certificate_consultation_patient_coordination",
    "moduleId": "consultants_module_10_clinical_photography_documentation_handover",
    "slug": "doctor-handover-note-task",
    "title": "Doctor Handover Note Task",
    "taskType": "handover",
    "status": "draft",
    "instructions": "Prepare a complete handover note using standard headings and neutral language.",
    "submissionFormat": ["text"],
    "facultyReviewRequired": true,
    "rubric": [{ "id": "r4", "label": "Handover usefulness", "weight": 10, "guidance": "Assess whether the note is complete, neutral, and clinically useful." }],
    "linkedCompetencyIds": ["consultants_competency_10_documentation_handover"],
    "linkedComplianceNoticeIds": ["notice_consultants_competency_scope"]
  },
  {
    "id": "consultants_task_13_difficult_consultations_high_risk_scenarios",
    "programId": "program_certificate_consultation_patient_coordination",
    "moduleId": "consultants_module_13_difficult_consultations_high_risk_scenarios",
    "slug": "high-risk-consultation-response-task",
    "title": "High-Risk Consultation Response Task",
    "taskType": "roleplay",
    "status": "draft",
    "instructions": "Respond to a vulnerable high-risk consultation scenario with safe communication and escalation planning.",
    "submissionFormat": ["text"],
    "facultyReviewRequired": true,
    "rubric": [{ "id": "r5", "label": "Ethical response quality", "weight": 10, "guidance": "Assess ethics, de-escalation, and protection from pressure." }],
    "linkedCompetencyIds": ["consultants_competency_13_high_risk_scenario_management"],
    "linkedComplianceNoticeIds": ["notice_consultants_escalation_duty"]
  },
  {
    "id": "consultants_task_15_final_competency_assessment",
    "programId": "program_certificate_consultation_patient_coordination",
    "moduleId": "consultants_module_15_final_competency_assessment",
    "slug": "full-pathway-capstone-task",
    "title": "Full Pathway Capstone Task",
    "taskType": "reflection",
    "status": "draft",
    "instructions": "Complete the final integrated consultation-support capstone with structured rationale at each decision point.",
    "submissionFormat": ["text"],
    "facultyReviewRequired": true,
    "rubric": [{ "id": "r6", "label": "Integrated competency", "weight": 20, "guidance": "Assess communication, documentation, escalation, scope, and coordination together." }],
    "linkedCompetencyIds": ["consultants_competency_15_capstone_consultation_pathway"],
    "linkedComplianceNoticeIds": [
      "notice_consultants_competency_scope",
      "notice_consultants_escalation_duty"
    ]
  }
]
